{
  "pi_a": [
    "11857428087037456615716338570479145279720483230853869251362536064984844595903",
    "16691710828654163899567086622529243220908116875461304127272965769937985754944",
    "1"
  ],
  "pi_b": [
    [
      "5120569900671118888571205526972008781795262564005507433791196800412360249991",
      "3127554451499983405373677940157572999622120611161858453484214383563695696314"
    ],
    [
      "3614826810688200018585668799643215101184394267043744645618121267718382268612",
      "3510306689198880136676215773695362954301451122503760474644341405819186215090"
    ],
    [
      "1",
      "0"
    ]
  ],
  "pi_c": [
    "2000208687581642175563007595127606318796116443893015212459903599278711556477",
    "748122369207391586797645625192437045959517743531068972959737341567316730316",
    "1"
  ],
  "protocol": "groth16",
  "curve": "bn128"
}